{
  "schema_version": "decision-v1",
  "decision_id": "decision-901",
  "request_id": "ctx-drop-1042",
  "event_id": "drop-1042",
  "incident_id": "inc-drop-1042",
  "incident_version": 1,
  "decision": "ALLOW_TEMPORARY",
  "grant_scope": {
    "source_ip": "10.0.2.1",
    "destination_ip": "10.0.3.10",
    "destination_port": 443,
    "protocol": "tcp"
  },
  "ttl_seconds": 300,
  "approved_by": {
    "id": "manager-12",
    "role": "network-manager"
  },
  "justification": "Employee is performing authorized remote maintenance",
  "issued_at": "2026-07-18T17:01:14Z"
}
